{
  "$schema": "https://json-schema.org/draft/2020-12/schema",
  "$id": "https://uni-regensburg.de/flugblattsammlung/schema/organizations-1.0.json",
  "title": "Normdatei der ausstellenden Organisationen",
  "description": "Kontrolliertes Vokabular. Von Hand gepflegt, waechst aus den unaufgeloesten Schreibweisen des Builds. Ohne diese Datei ist 'wie viele Blaetter kamen vom SDS?' nicht beantwortbar, weil dieselbe Gruppe in Dutzenden OCR-Varianten auftritt.",
  "type": "array",
  "items": {
    "type": "object",
    "required": ["org_id", "name", "type", "variants"],
    "additionalProperties": false,
    "properties": {
      "org_id": { "type": "string", "pattern": "^[a-z0-9_]+$", "description": "Stabiler Schluessel, wird in documents.jsonl referenziert." },
      "name": { "type": "string", "description": "Kurzform fuer Anzeige und Diagramme.", "examples": ["LSD", "SDS"] },
      "full_name": { "type": "string", "examples": ["Liberaler Studentenbund Deutschlands"] },
      "type": {
        "enum": ["studentische_gruppe", "partei", "gewerkschaft", "hochschulorgan", "kirchliche_gruppe", "ad_hoc_komitee", "sonstige", "unbekannt"]
      },
      "spectrum": { "type": "string", "description": "Grobe politische Verortung - optional und bewusst unscharf.", "examples": ["liberal", "sozialistisch", "christlich-konservativ"] },
      "variants": {
        "type": "array",
        "minItems": 1,
        "items": { "type": "string" },
        "description": "Schreibweisen, die auf diesen Eintrag abgebildet werden - inkl. typischer OCR-Verballhornungen."
      },
      "active_from": { "type": ["string", "null"], "description": "EDTF, optional." },
      "active_to": { "type": ["string", "null"], "description": "EDTF, optional." },
      "gnd_id": { "type": "string", "default": "", "description": "GND-Nummer, falls die Gruppe normdatenmaessig erfasst ist - macht spaeteren Bibliotheks-Anschluss moeglich." },
      "notes": { "type": "string", "default": "" }
    }
  }
}
